<?xml version="1.0" encoding="UTF-8"?>
<!--<!DOCTYPE questionnaire SYSTEM "dialog.dtd">-->

<dialogue name="Information">
    <personnage name="hero">
        <text> Voilà, c'est réparé ! Maintenant, expliquez-moi comment affaiblir Vektor. </text>
    </personnage>
    <personnage name="gwendouille">
        <text> Affaiblir Viktor ? Ta question est bizarre mais on va quand même te répondre. </text>
    </personnage>
    <personnage name="audib">
        <text> Le pouvoir de Vektor repose sur le portail sur lequel est construit sa tour. </text>
        <text> Elle draine l'énergie du portail, et Vektor se sert de ça pour lancer ses mathémaléfices et rendre les maths encore plus compliquées. </text>
    </personnage>
    <personnage name="hero">
        <text> Donc je dois détruire sa tour pour l'affaiblir ? </text>
    </personnage>
    <personnage name="gwendouille">
        <text> Ah ! Comme si c'était simple ! </text>
        <text> La Tour de Vektor a été construite à l'aide d'anciens outils mathémagiques qu'ont utilisé les dieux pour bâtir notre monde. </text>
    </personnage>
    <personnage name="hero">
        <text> Des outils mathémagiques ? </text>
    </personnage>
    <personnage name="audib">
        <text> Oui. Quiconque possède ces artefacts peut construire et détruire à loisir. </text>
        <text> Malheureusement après les avoir utilisés pour ses noirs desseins, Vektor a caché ces artefacts dans 3 sanctuaires gardés par ses sbires. </text>
    </personnage>
    <personnage name="hero">
        <text> Et où sont ces santuaires ? </text>
    </personnage>
    <personnage name="audib">
        <text> Personne ne le sait vraiment. Les gens parlent d'une forêt, d'un lac et des nuages... </text>
        <text> Tu les trouveras sans doutes aux alentours du village. </text>
    </personnage>
    <personnage name="hero">
        <text> D'accord. Merci ! </text>
    </personnage>
    <personnage name="audib">
        <text> N'hésites pas à revenir nous voir si tu as des questions. </text>
    </personnage>
    <personnage name="gwendouille">
        <text> Mais ramènes du café ! </text>
    </personnage>
</dialogue>