<?xml version="1.0" encoding="UTF-8"?>
<!--<!DOCTYPE questionnaire SYSTEM "dialog.dtd">-->

<dialogue name="Plongee">
    <personnage name="hero">
        <text> Pfiou, j'ai eu chaud ! Heureusement que - Aïe aïe aïe ! </text>
    </personnage>
    <personnage name="genie">
        <text> Heureusement que t'as la tête dur toi ! </text>
    </personnage>
    <personnage name="hero">
        <text> Bon, qu'est-ce qui se passe ici ?! C'était quoi ça, là-haut ?! Et où est-ce que j'ai encore atteri ?! </text>
    </personnage>
    <personnage name="genie">
        <text> Bah, dans une caverne du monde des Maths ! C'est pourtant évident ! </text>
    </personnage>
    <personnage name="hero">
        <text> Le monde des Maths ? Alors ça doit être pour ça que je comprends rien, je suis nul en maths... </text>
    </personnage>
    <personnage name="genie">
        <text> Avançons. Je t'expliquerai en chemin. </text>
        <text> Autrefois, le monde des Maths était paisible. Les hommes et les expressions mathématiques vivaient en harmonie.</text>
        <text> Nul problème n'était insovable. Et puis... Vektor est arrivé. </text>
    </personnage>
    <personnage name="hero">
        <text> Vektor ? </text>
    </personnage>
    <personnage name="genie">
        <text> L'homme que tu as aperçu tout à l'heure. C'est le seigneur des Mathémaléfices. </text>
        <text> C'est à cause de lui que le monde des maths est si obscure et que ces expressions t'ont attaqué. </text>
        <text> Son plan est de faire tendre la difficulté des maths vers l'infini... </text>
    </personnage>
    <personnage name="hero">
        <text> Ben il doit vraiment s'ennuyer... </text>
    </personnage>
    <personnage name="genie">
        <text> C'est très grave ! Si personne ne l'arrête, il - </text>
    </personnage>
    <personnage name="ennemi">
        <text> C'est lui ! Attrapez-le ! </text>
    </personnage>
    <personnage name="genie">
        <text> Les sbires de Vektor ! Il y a une rivière pas loin, vite, cours et saute dedans !</text>
    </personnage>
</dialogue>