<?xml version="1.0" encoding="UTF-8"?>
<!DOCTYPE dialogue SYSTEM "dialog.dtd">

<dialogue>
    <personnage name="hero" pos="0">
        <text> Euh... T'es sûr que c'était de la magie ça ? Ca ressemblait plutôt à de la sorcellerie... </text>
    </personnage>
    <personnage name="genie" pos="1">
        <text> C'était de la magie ! De la mathémagie noire ! </text>
    </personnage>
    <personnage name="mathrandir" pos="3">
        <text> Ma mathémagie a été vaincue... Je reconnais la puissance de ta logique, jeune inconnu. </text>
        <text> L'artefact est à toi. </text>
    </personnage>
</dialogue>
